{"id": "fx.an05.upper1", "version": 1, "name": "upper1", "summary": "Coverage fixture drill (ST-059).", "skills": [], "target_metrics": ["AN-05"], "level_min": "intermediate", "level_max": "advanced", "duration_min": 10, "duration_max": 15, "players": 2, "needs": ["half_court"], "equipment": ["balls"], "setup": ["Fixture only"], "success_criterion": "8 of 10", "progressions": [], "regressions": [], "safety_notes": "", "coach_rationale": "(judgment) fixture", "review_status": "coach-reviewed"}
