{"id": "fx.warm-up.b", "version": 1, "name": "b", "summary": "Coverage fixture drill (ST-059).", "skills": ["warm-up"], "target_metrics": ["AN-04"], "level_min": "beginner", "level_max": "advanced", "duration_min": 10, "duration_max": 15, "players": 2, "needs": ["half_court"], "equipment": ["balls"], "setup": ["Fixture only"], "success_criterion": "8 of 10", "progressions": [], "regressions": [], "safety_notes": "", "coach_rationale": "(judgment) fixture", "review_status": "coach-reviewed"}
