{"id": "fx.solo-wall.w2", "version": 1, "name": "w2", "summary": "Coverage fixture drill: solo+wall at intermediate only, so the AN-05 x beginner gap stays the only one (QA-VERIFY04R3-01).", "skills": ["AN-07", "share:fault", "share:forced-error"], "target_metrics": ["AN-01", "AN-02", "AN-04", "AN-05", "AN-07"], "level_min": "intermediate", "level_max": "intermediate", "duration_min": 10, "duration_max": 15, "players": 1, "needs": ["wall"], "equipment": ["balls"], "setup": ["Fixture only"], "success_criterion": "8 of 10", "progressions": [], "regressions": [], "safety_notes": "", "coach_rationale": "(judgment) fixture", "review_status": "coach-reviewed"}
