{"id": "fx.an05.foursome1", "version": 1, "name": "foursome1", "summary": "Coverage fixture drill (ST-059).", "skills": [], "target_metrics": ["AN-05"], "level_min": "beginner", "level_max": "beginner", "duration_min": 10, "duration_max": 15, "players": 4, "needs": ["half_court"], "equipment": ["balls"], "setup": ["Fixture only"], "success_criterion": "8 of 10", "progressions": [], "regressions": [], "safety_notes": "", "coach_rationale": "(judgment) fixture", "review_status": "coach-reviewed"}
